17:17:54.428028 IP 127.0.0.1.58770 > 127.0.0.1.12345: Flags [S], seq 2727199882, win 65535, options [mss 16344,nop,wscale 6,nop,nop,TS val 1585083196 ecr 0,sackOK,eol], length 0
E..@..@.@.............09.............4....?........
^zs<........
17:17:54.428241 IP 127.0.0.1.12345 > 127.0.0.1.58770: Flags [S.], seq 3547149541, ack 2727199883, win 65535, options [mss 16344,nop,wscale 6,nop,nop,TS val 3112160866 ecr 1585083196,sackOK,eol], length 0
E..@..@.@...........09...m4..........4....?........
...b^zs<....
17:17:54.428283 IP 127.0.0.1.58770 > 127.0.0.1.12345: Flags [.], ack 1, win 6379, options [nop,nop,TS val 1585083196 ecr 3112160866], length 0
E..4..@.@.............09.....m4......(.....
^zs<...b
17:17:54.428305 IP 127.0.0.1.12345 > 127.0.0.1.58770: Flags [.], ack 1, win 6379, options [nop,nop,TS val 3112160866 ecr 1585083196], length 0
E..4..@.@...........09...m4..........(.....
...b^zs<
17:17:54.428323 IP 127.0.0.1.58770 > 127.0.0.1.12345: Flags [P.], seq 1:19, ack 1, win 6379, options [nop,nop,TS val 1585083196 ecr 3112160866], length 18
E..F..@.@.............09.....m4......:.....
^zs<...bHello from client!
17:17:54.428353 IP 127.0.0.1.12345 > 127.0.0.1.58770: Flags [.], ack 19, win 6379, options [nop,nop,TS val 3112160866 ecr 1585083196], length 0
E..4..@.@...........09...m4..........(.....
...b^zs<
17:17:54.428413 IP 127.0.0.1.12345 > 127.0.0.1.58770: Flags [P.], seq 1:19, ack 19, win 6379, options [nop,nop,TS val 3112160866 ecr 1585083196], length 18
E..F..@.@...........09...m4..........:.....
...b^zs<Hello from server!
17:17:54.428425 IP 127.0.0.1.12345 > 127.0.0.1.58770: Flags [F.], seq 19, ack 19, win 6379, options [nop,nop,TS val 3112160866 ecr 1585083196], length 0
E..4..@.@...........09...m4..........(.....
...b^zs<
17:17:54.428443 IP 127.0.0.1.58770 > 127.0.0.1.12345: Flags [.], ack 19, win 6379, options [nop,nop,TS val 1585083196 ecr 3112160866], length 0
E..4..@.@.............09.....m4......(.....
^zs<...b
17:17:54.428458 IP 127.0.0.1.58770 > 127.0.0.1.12345: Flags [.], ack 20, win 6379, options [nop,nop,TS val 1585083196 ecr 3112160866], length 0
E..4..@.@.............09.....m4......(.....
^zs<...b
17:17:54.428495 IP 127.0.0.1.58770 > 127.0.0.1.12345: Flags [F.], seq 19, ack 20, win 6379, options [nop,nop,TS val 1585083196 ecr 3112160866], length 0
E..4..@.@.............09.....m4......(.....
^zs<...b
17:17:54.428553 IP 127.0.0.1.12345 > 127.0.0.1.58770: Flags [.], ack 20, win 6379, options [nop,nop,TS val 3112160866 ecr 1585083196], length 0
E..4..@.@...........09...m4..........(.....
...b^zs<

